{
  "case_metadata": {
    "pseudonymous_case_id": "CASE-SC10",
    "schema_version": "1.0.0",
    "rubric_specification_version": "SURGICAL-COMPLEXITY-v1.0",
    "case_creation_timestamp": "2026-10-20T10:00:00Z",
    "patient_age_group": "ADULT_18_TO_64",
    "asa_physical_status": "ASA_I"
  },
  "fracture_characterization": {
    "fracture_locations": [
      "FRONTAL_SINUS_ANTERIOR_TABLE",
      "FRONTAL_SINUS_POSTERIOR_TABLE",
      "NASOETHMOID_COMPLEX",
      "ORBITAL_ROOF"
    ],
    "documented_severity": "COMMINUTED_SEGMENTAL",
    "bilateral_injury": false,
    "panfacial_involvement": false,
    "occlusal_derangement_preop": "PRESERVED_NORMAL"
  },
  "operative_details": {
    "anatomical_regions_operated": [
      "UPPER_FACE_CRANIOFACIAL",
      "ORBITAL_INTERNAL"
    ],
    "bones_operated": [
      "FRONTAL_BONE",
      "NASAL_ETHMOID_BONES"
    ],
    "reduction_complexity": "OPEN_DIRECT_ANATOMIC_SIMPLE",
    "procedures_performed": [
      "FRONTAL_SINUS_OBLITERATION_OR_CRANIALIZATION",
      "OPEN_REDUCTION_INTERNAL_FIXATION",
      "CANTHOPEXY_MEDIAL_OR_LATERAL"
    ],
    "surgical_approaches": [
      "CORONAL_BICORONAL"
    ],
    "staged_procedure": {
      "is_staged": false,
      "stage_number": null,
      "total_planned_stages": null,
      "timing_description": null
    }
  },
  "hardware_inventory": {
    "hardware_documented": true,
    "plate_count": 2,
    "screw_count": 8,
    "mesh_implant_count": 0,
    "custom_patient_specific_implant_used": false,
    "reconstruction_plate_used": false,
    "fixation_sites": [
      "ZYGOMATICOMAXILLARY_BUTTRESS",
      "INFRAORBITAL_RIM"
    ]
  },
  "soft_tissue_and_associated_injuries": {
    "extensive_facial_lacerations_or_degloving": false,
    "primary_nerve_repair_or_decompression": false,
    "lacrimal_system_repair_or_intubation": false,
    "concomitant_cervical_spine_injury": true,
    "concomitant_traumatic_brain_injury": true,
    "concomitant_vascular_injury": false
  },
  "intraoperative_events_and_resources": {
    "operative_duration_minutes": 380.0,
    "estimated_blood_loss_ml": 550.0,
    "blood_transfusion_units": 0.0,
    "intraoperative_complications": [
      "NONE_DOCUMENTED"
    ],
    "unplanned_additional_interventions": []
  },
  "complexity_evaluation_audit": {
    "evaluator_disclaimer": "PROTOTYPE TESTING FIXTURE: Synthetic fictional case.",
    "surgeon_validation_status": "PENDING_SURGEON_CONSENSUS_VALIDATION",
    "composite_score_status": "PROHIBITED_UNVALIDATED_PROFILE_ONLY",
    "known_postoperative_outcome_reference": "UNCOMPLICATED_HEALING"
  }
}