{
  "case_metadata": {
    "pseudonymous_case_id": "CASE-SC03",
    "schema_version": "1.0.0",
    "rubric_specification_version": "SURGICAL-COMPLEXITY-v1.0",
    "case_creation_timestamp": "2026-10-20T10:00:00Z",
    "patient_age_group": "ADULT_18_TO_64",
    "asa_physical_status": "ASA_I"
  },
  "fracture_characterization": {
    "fracture_locations": [
      "FRONTAL_SINUS_ANTERIOR_TABLE",
      "LE_FORT_II",
      "LE_FORT_III",
      "ZYGOMATICOMAXILLARY_COMPLEX",
      "ORBITAL_FLOOR",
      "MANDIBULAR_SYMPHYSIS_PARASYMPHYSIS",
      "MANDIBULAR_CONDYLE_HEAD_NECK"
    ],
    "documented_severity": "COMMINUTED_SEGMENTAL",
    "bilateral_injury": true,
    "panfacial_involvement": true,
    "occlusal_derangement_preop": "GROSS_DISARTICULATION"
  },
  "operative_details": {
    "anatomical_regions_operated": [
      "UPPER_FACE_CRANIOFACIAL",
      "ORBITAL_INTERNAL",
      "MIDFACE_MAXILLARY_ZYGOMATIC",
      "LOWER_FACE_MANDIBULAR"
    ],
    "bones_operated": [
      "FRONTAL_BONE",
      "ZYGOMA",
      "MAXILLA",
      "MANDIBLE"
    ],
    "reduction_complexity": "OPEN_COMMINUTED_REASSEMBLY_PUZZLE",
    "procedures_performed": [
      "OPEN_REDUCTION_INTERNAL_FIXATION",
      "INTERNAL_ORBITAL_RECONSTRUCTION_MESH",
      "INTERMAXILLARY_FIXATION_APPLICATION",
      "TRACHEOSTOMY_SURGICAL"
    ],
    "surgical_approaches": [
      "CORONAL_BICORONAL",
      "TRANSCONJUNCTIVAL_RETROSEPTAL_PRESEPTAL",
      "MAXILLARY_VESTIBULAR_GINGIVOBUCCAL",
      "MANDIBULAR_VESTIBULAR_INTRAORAL"
    ],
    "staged_procedure": {
      "is_staged": false,
      "stage_number": null,
      "total_planned_stages": null,
      "timing_description": null
    }
  },
  "hardware_inventory": {
    "hardware_documented": true,
    "plate_count": 7,
    "screw_count": 28,
    "mesh_implant_count": 2,
    "custom_patient_specific_implant_used": false,
    "reconstruction_plate_used": true,
    "fixation_sites": [
      "FRONTOMAXILLARY_BUTTRESS",
      "ZYGOMATICOMAXILLARY_BUTTRESS_BILATERAL",
      "INFRAORBITAL_RIM_BILATERAL",
      "MANDIBULAR_INFERIOR_BORDER_RECON",
      "MANDIBULAR_ALVEOLAR_TENSION_BAND"
    ]
  },
  "soft_tissue_and_associated_injuries": {
    "extensive_facial_lacerations_or_degloving": true,
    "primary_nerve_repair_or_decompression": false,
    "lacrimal_system_repair_or_intubation": false,
    "concomitant_cervical_spine_injury": true,
    "concomitant_traumatic_brain_injury": true,
    "concomitant_vascular_injury": false
  },
  "intraoperative_events_and_resources": {
    "operative_duration_minutes": 430.0,
    "estimated_blood_loss_ml": 950.0,
    "blood_transfusion_units": 2.0,
    "intraoperative_complications": [
      "NONE_DOCUMENTED"
    ],
    "unplanned_additional_interventions": []
  },
  "complexity_evaluation_audit": {
    "evaluator_disclaimer": "PROTOTYPE TESTING FIXTURE: Synthetic fictional case.",
    "surgeon_validation_status": "PENDING_SURGEON_CONSENSUS_VALIDATION",
    "composite_score_status": "PROHIBITED_UNVALIDATED_PROFILE_ONLY",
    "known_postoperative_outcome_reference": "SATISFACTORY_SYMMETRY_AND_OCCLUSION_DESPITE_EXTREME_SURGERY"
  }
}