{
  "case_metadata": {
    "pseudonymous_case_id": "CASE-SC12",
    "schema_version": "1.0.0",
    "rubric_specification_version": "SURGICAL-COMPLEXITY-v1.0",
    "case_creation_timestamp": "2026-10-20T10:00:00Z",
    "patient_age_group": "ADULT_18_TO_64",
    "asa_physical_status": "ASA_I"
  },
  "fracture_characterization": {
    "fracture_locations": [
      "ZYGOMATICOMAXILLARY_COMPLEX",
      "MANDIBULAR_ANGLE",
      "MANDIBULAR_BODY"
    ],
    "documented_severity": "HIGH_ENERGY_CRUSH_BONE_LOSS",
    "bilateral_injury": false,
    "panfacial_involvement": false,
    "occlusal_derangement_preop": "PRESERVED_NORMAL"
  },
  "operative_details": {
    "anatomical_regions_operated": [
      "MIDFACE_MAXILLARY_ZYGOMATIC",
      "LOWER_FACE_MANDIBULAR"
    ],
    "bones_operated": [
      "ZYGOMA",
      "MAXILLA",
      "MANDIBLE"
    ],
    "reduction_complexity": "OPEN_DIRECT_ANATOMIC_SIMPLE",
    "procedures_performed": [
      "OPEN_REDUCTION_INTERNAL_FIXATION",
      "AUTOLOGOUS_BONE_GRAFTING"
    ],
    "surgical_approaches": [
      "LOCAL_LACERATION_EXISTING",
      "RISDON_SUBMANDIBULAR",
      "MAXILLARY_VESTIBULAR_GINGIVOBUCCAL"
    ],
    "staged_procedure": {
      "is_staged": false,
      "stage_number": null,
      "total_planned_stages": null,
      "timing_description": null
    }
  },
  "hardware_inventory": {
    "hardware_documented": true,
    "plate_count": 5,
    "screw_count": 20,
    "mesh_implant_count": 0,
    "custom_patient_specific_implant_used": false,
    "reconstruction_plate_used": true,
    "fixation_sites": [
      "ZYGOMATICOMAXILLARY_BUTTRESS",
      "INFRAORBITAL_RIM"
    ]
  },
  "soft_tissue_and_associated_injuries": {
    "extensive_facial_lacerations_or_degloving": true,
    "primary_nerve_repair_or_decompression": true,
    "lacrimal_system_repair_or_intubation": true,
    "concomitant_cervical_spine_injury": false,
    "concomitant_traumatic_brain_injury": false,
    "concomitant_vascular_injury": false
  },
  "intraoperative_events_and_resources": {
    "operative_duration_minutes": 390.0,
    "estimated_blood_loss_ml": 650.0,
    "blood_transfusion_units": 0.0,
    "intraoperative_complications": [
      "NONE_DOCUMENTED"
    ],
    "unplanned_additional_interventions": []
  },
  "complexity_evaluation_audit": {
    "evaluator_disclaimer": "PROTOTYPE TESTING FIXTURE: Synthetic fictional case.",
    "surgeon_validation_status": "PENDING_SURGEON_CONSENSUS_VALIDATION",
    "composite_score_status": "PROHIBITED_UNVALIDATED_PROFILE_ONLY",
    "known_postoperative_outcome_reference": "UNCOMPLICATED_HEALING"
  }
}